### ISSUE TITLE
Improve and document current single-thread JVM Agent usage

### ISSUE THREAD

**Issue by grgrzybek** [rhuss/jolokia#1029]
Here's the reason:
* #1026
* https://github.com/jolokia/jolokia/commit/6069dc47cfa735befcdfe8e8951a248908748c4c
* https://docs.oracle.com/en/java/javase/21/docs/api/jdk.httpserver/module-summary.html

This AI generated PR is simply an indication that Jolokia does not set `sun.net.httpserver.maxReqTime` system property. And it shouldn't, because who knows what other parts of JVM rely on built-in JDK HTTP Server?

But this doesn't mean we don't need to do anything:
* `single` is not a good default for HTTP Server executor
* Jolokia should reconsider sending `Connection: close` response header - because when we _navigate_ to Jolokia URL from a browser, the browser usually sends `Connection: keep-alive` and it'll also keep the connection awaiting for next HTTP request over existing TCP connection by re-adding the task to a queue. It is always a bad practice when single-threaded executor is used.
* Sending partial requests (as shown in #1026) always keeps the single thread busy and no other client can connect.

Technically, when JDK HTTP Server gets `Connection: keep-alive`, it may mark the connection as "let's close it" when the response header contains `Connection: close`, but when it doesn't do this, we have:

1. `sun.net.httpserver.ServerImpl.Dispatcher#handleEvent()` adds existing connection to `sun.net.httpserver.ServerImpl.Dispatcher#connsToRegister` in `HTTP-Dispatcher` thread
2. `sun.net.httpserver.ServerImpl.Dispatcher#reRegister()` is called for this connection and it's added to `sun.net.httpserver.ServerImpl#idleConnections()`
3. `java.nio.channels.Selector#select(long)` continues and selected keys is not empty. Our not closed connection is "read ready"
4. `sun.net.httpserver.ServerImpl#requestStarted()` is called on this idle connection and it's added to `sun.net.httpserver.ServerImpl#reqConnections`
5. `sun.net.httpserver.ServerImpl.Dispatcher#handle()` is called which executes an `sun.net.httpserver.ServerImpl.Exchange` task in the executor
6. single thread `jolokia-0` receives a task from the queue in `java.util.concurrent.ThreadPoolExecutor#getTask()`
7. `sun.net.httpserver.ServerImpl.Exchange#run()` is called and `sun.net.httpserver.Request#Request()` constructor tries to read new HTTP request hanging at:
```
"jolokia-0@3341" daemon prio=5 tid=0x21 nid=NA runnable
  java.lang.Thread.State: RUNNABLE
	at sun.nio.ch.SocketDispatcher.read0(SocketDispatcher.java:-1)
	at sun.nio.ch.SocketDispatcher.read(SocketDispatcher.java:47)
	at sun.nio.ch.IOUtil.readIntoNativeBuffer(IOUtil.java:330)
	at sun.nio.ch.IOUtil.read(IOUtil.java:296)
	at sun.nio.ch.IOUtil.read(IOUtil.java:259)
	at sun.nio.ch.SocketChannelImpl.read(SocketChannelImpl.java:417)
	at sun.net.httpserver.Request$ReadStream.read(Request.java:318)
	  - locked <0x1039> (a sun.net.httpserver.Request$ReadStream)
	at java.io.BufferedInputStream.fill(BufferedInputStream.java:244)
	at java.io.BufferedInputStream.read(BufferedInputStream.java:263)
	  - locked <0x103a> (a java.io.BufferedInputStream)
	at sun.net.httpserver.Request.readLine(Request.java:83)
	at sun.net.httpserver.Request.<init>(Request.java:52)
	at sun.net.httpserver.ServerImpl$Exchange.run(ServerImpl.java:675)
	at java.util.concurrent.ThreadPoolExecutor.runWorker(ThreadPoolExecutor.java:1136)
	at java.util.concurrent.ThreadPoolExecutor$Worker.run(ThreadPoolExecutor.java:635)
	at java.lang.Thread.run(Thread.java:840)
```

Additionally after Firefox completes the HTTP exchange with `Connection: close`, I observed (in a debugger) another socket.accept() and the relevant tcpdump showed:
```
12:28:37.679352 IP 192.168.8.100.59748 > 192.168.8.100.7778: Flags [S], seq 2600860327, win 65495, options [mss 65495,sackOK,TS val 2472420726 ecr 0,nop,wscale 10], length 0
	0x0000:  4500 003c 03b4 4000 4006 a4ef c0a8 0864  E..<..@.@......d
	0x0010:  c0a8 0864 e964 1e62 9b05 faa7 0000 0000  ...d.d.b........
	0x0020:  a002 ffd7 9247 0000 0204 ffd7 0402 080a  .....G..........
	0x0030:  935e 2576 0000 0000 0103 030a            .^%v........
12:28:37.679373 IP 192.168.8.100.7778 > 192.168.8.100.59748: Flags [S.], seq 3062399955, ack 2600860328, win 65483, options [mss 65495,sackOK,TS val 3480375657 ecr 2472420726,nop,wscale 10], length 0
	0x0000:  4500 003c 0000 4000 4006 a8a3 c0a8 0864  E..<..@.@......d
	0x0010:  c0a8 0864 1e62 e964 b688 83d3 9b05 faa8  ...d.b.d........
	0x0020:  a012 ffcb 9247 0000 0204 ffd7 0402 080a  .....G..........
	0x0030:  cf72 5169 935e 2576 0103 030a            .rQi.^%v....
12:28:37.679384 IP 192.168.8.100.59748 > 192.168.8.100.7778: Flags [.], ack 1, win 64, options [nop,nop,TS val 2472420726 ecr 3480375657], length 0
	0x0000:  4500 0034 03b5 4000 4006 a4f6 c0a8 0864  E..4..@.@......d
	0x0010:  c0a8 0864 e964 1e62 9b05 faa8 b688 83d4  ...d.d.b........
	0x0020:  8010 0040 923f 0000 0101 080a 935e 2576  ...@.?.......^%v
	0x0030:  cf72 5169                                .rQi
12:28:37.680228 IP 192.168.8.100.59748 > 192.168.8.100.7778: Flags [P.], seq 1:1859, ack 1, win 64, options [nop,nop,TS val 2472420727 ecr 3480375657], length 1858
	0x0000:  4500 0776 03b6 4000 4006 9db3 c0a8 0864  E..v..@.@......d
	0x0010:  c0a8 0864 e964 1e62 9b05 faa8 b688 83d4  ...d.d.b........
	0x0020:  8018 0040 9981 0000 0101 080a 935e 2577  ...@.........^%w
	0x0030:  cf72 5169 1603 0107 3d01 0007 3903 0370  .rQi....=...9..p
	0x0040:  e126 e27b c8dc c429 8aaf 6d34 ec39 3dda  .&.{...)..m4.9=.
	0x0050:  fb8d 74c7 4c02 039d 0777 2d7e 01fb 4820  ..t.L....w-~..H.
	0x0060:  caab d1b3 2ef6 d296 bf49 f865 9985 befb  .........I.e....
	0x0070:  d5d0 5dd1 98e4 e6e9 868d 0431 afb0 abf3  ..]........1....
	0x0080:  0020 1301 1303 1302 c02b c02f cca9 cca8  .........+./....
	0x0090:  c02c c030 c00a c013 c014 009c 009d 002f  .,.0.........../
	0x00a0:  0035 0100 06d0 0017 0000 ff01 0001 0000  .5..............
	0x00b0:  0a00 1000 0e11 ec00 1d00 1700 1800 1901  ................
	0x00c0:  0001 0100 0b00 0201 0000 1000 0e00 0c02  ................
	0x00d0:  6832 0868 7474 702f 312e 3100 0500 0501  h2.http/1.1.....
	0x00e0:  0000 0000 0022 0008 0006 0403 0503 0603  ....."..........
	0x00f0:  0012 0000 0033 052f 052d 11ec 04c0 04e3  .....3./.-......
	0x0100:  9562 6692 15a0 0380 f500 c1f0 535e e010  .bf.........S^..
	0x0110:  93a4 6abb d6bc 550a 2193 304e 6055 2cf9  ..j...U.!.0N`U,.
	0x0120:  3695 b634 6971 5c06 9806 25ff ca36 6430  6..4iq\...%..6d0
	0x0130:  a97c d74a 9776 5030 6485 fd37 7870 42aa  .|.J.vP0d..7xpB.
	0x0140:  c429 af85 5955 308c 8366 4891 aa78 cc08  .)..YU0..fH..x..
	0x0150:  3570 7254 91b6 d91d 4bf0 4352 a75f 7506  5prT....K.CR._u.
	0x0160:  c4f1 62be 18f6 5516 c1a0 dd99 18d9 a90a  ..b...U.........
	0x0170:  8f53 ca24 6215 29e6 25a7 1745 1453 c93a  .S.$b.).%..E.S.:
	0x0180:  6ca8 c6e7 8408 2671 1e06 afb5 e784 8ea0  l.....&q........
	0x0190:  3f10 c389 ba62 76e8 9591 7ee6 604c 8340  ?....bv...~.`L.@
	0x01a0:  0366 09ff 0ac5 92f8 3b66 857f 05cc a69f  .f......;f......
	0x01b0:  98bd 8b02 c270 3867 56b7 7a55 6c55 3fac  .....p8gV.zUlU?.
	0x01c0:  530f 129f 61b9 895f f14e 9081 6fa5 2061  S...a.._.N..o..a
	0x01d0:  ad13 26b8 572b a3f6 9ef0 4ac0 6a56 b8a7  ..&.W+....J.jV..
	0x01e0:  7c9b 0f3b a039 435c f587 0eab 559a 1317  |..;.9C\....U...
	0x01f0:  a07d 217a 58f2 b466 c454 45e7 80d9 5c7e  .}!zX..f.TE...\~
	0x0200:  d993 6f38 f004 e4f7 3b1e 9773 290c 04c0  ..o8....;..s)...
	0x0210:  99b3 16d1 b25a 115d 1e91 c3ad 84cf 244a  .....Z.]......$J
	0x0220:  a61b 8436 3599 0fc4 d4c0 6a58 4608 a277  ...65.....jXF..w
	0x0230:  d589 25ca c785 2f56 7d7b c624 d322 55de  ..%.../V}{.$."U.
	0x0240:  764f 5e46 9d94 e346 7a37 a987 2738 0d14  vO^F...Fz7..'8..
	0x0250:  b81a dc75 77f7 aa13 8c21 a1c8 499a dbc7  ...uw....!..I...
	0x0260:  0253 43e1 80b6 4b86 6bc6 693a 0cc4 beb6  .SC...K.k.i:....
	0x0270:  8b2a 4f9c be28 4644 c552 7ad2 532e a022  .*O..(FD.Rz.S.."
	0x0280:  8132 b570 3931 2246 ab8a 67a5 868f 2c37  .2.p91"F..g...,7
	0x0290:  a2fc bf00 39c0 7e94 2b33 8790 9077 cb6f  ....9.~.+3...w.o
	0x02a0:  cb6a 00b1 be58 34bb 7bc6 7a3b 1b73 9f32  .j...X4.{.z;.s.2
	0x02b0:  2cf0 ba83 1b06 ac55 54c0 81cb 2699 f564  ,......UT...&..d
	0x02c0:  99f9 af9f cba3 5686 c513 9265 6af3 adc3  ......V....ej...
	0x02d0:  297d f345 8d13 8a88 298b 2fcf fa02 34e8  )}.E....)./...4.
	0x02e0:  836f da9d 2192 1b38 280f 43c8 53d4 bcac  .o..!..8(.C.S...
	0x02f0:  2d9c 1df7 4570 8546 166b 07b6 1532 59c4  -...Ep.F.k...2Y.
	0x0300:  1542 1249 213f 707d 094b a912 005e 99f1  .B.I!?p}.K...^..
	0x0310:  18cd e776 9c9a 3b28 a7ce b863 914a 081d  ...v..;(...c.J..
	0x0320:  da4c 3b51 8313 dbd9 3758 26b4 6fe7 2a7f  .L;Q....7X&.o.*.
	0x0330:  4ba1 c940 50c6 8a80 21d9 ca0e b28b 9357  K..@P...!......W
	0x0340:  3949 4362 9c88 9b03 d94c 01ac 381a ca9f  9ICb.....L..8...
	0x0350:  faec 5b8d b26b 58a3 79d0 5131 5dac 7550  ..[..kX.y.Q1].uP
	0x0360:  4845 5a07 9086 a22a aeb7 645e 4cce df09  HEZ....*..d^L...
	0x0370:  c640 bc6d b3e4 c4f4 1636 56e0 181f 4b2b  .@.m.....6V...K+
	0x0380:  af50 95d1 ba1a b121 3f52 480e ed29 9e57  .P.....!?RH..).W
	0x0390:  1b19 b96a bb0e fb52 ba77 9be8 a199 a71a  ...j...R.w......
	0x03a0:  8bb7 a4ba 2259 198b 0972 6823 bcbf a124  ...."Y...rh#...$
	0x03b0:  aa01 76c5 f713 a523 31c9 2427 84a2 aad0  ..v....#1.$'....
	0x03c0:  4104 c764 0862 c9cc 82e6 359e d853 983a  A..d.b....5..S.:
	0x03d0:  1990 8334 8227 3fb0 9116 b270 3dbc f003  ...4.'?....p=...
	0x03e0:  9d00 25dd d947 9897 4a90 2a16 8f52 6972  ..%..G..J.*..Rir
	0x03f0:  0baf 3c85 0cc4 121f 6be4 8091 b196 2247  ..<.....k....."G
	0x0400:  47ce 4034 4232 1786 b16b 5ab9 7615 d27f  G.@4B2...kZ.v...
	0x0410:  a750 5e7e 8224 04c9 8384 9243 db02 40e2  .P^~.$.....C..@.
	0x0420:  c546 92e3 69df 4641 36c9 075d 67c2 a09a  .F..i.FA6..]g...
	0x0430:  0847 e1c9 a2e9 bfbf e2a6 397a bb25 2303  .G........9z.%#.
	0x0440:  9d80 3694 f6ad 6881 681d a08a e89a a1a5  ..6...h.h.......
	0x0450:  fc7b a594 2caa e499 1649 cfed 5804 45c6  .{..,....I..X.E.
	0x0460:  11c4 f79f 2237 2190 614a 0372 65b3 65c2  ...."7!.aJ.re.e.
	0x0470:  3f61 12a9 42ab 353b 192e d0b5 1b8c 2344  ?a..B.5;......#D
	0x0480:  805c 9ab2 7e1d a58d 6114 4b47 c053 ebc6  .\..~...a.KG.S..
	0x0490:  0192 2a23 5c6a 4ea6 590c 8722 14a1 124d  ..*#\jN.Y.."...M
	0x04a0:  2e32 3aa7 7160 e872 1a43 8668 b452 1007  .2:.q`.r.C.h.R..
	0x04b0:  2616 b4a8 7269 697d 7567 907f c004 27d1  &...rii}ug....'.
	0x04c0:  5726 c8c7 48d1 2105 8cc3 546a aaf5 5a6b  W&..H.!...Tj..Zk
	0x04d0:  7229 b11a 1384 1459 3de8 989a b711 034c  r).....Y=......L
	0x04e0:  e148 d886 5061 965a 1c22 570b 698b 52e1  .H..Pa.Z."W.i.R.
	0x04f0:  a665 b848 46d5 a768 7957 1091 5d13 9992  .e.HF..hyW..]...
	0x0500:  a19c b2d8 6228 85a8 1bf9 a5a2 933c 91c2  ....b(.......<..
	0x0510:  4a5e f76b 6f5c 2a1d 6d14 5bcc ab61 75f7  J^.ko\*.m.[..au.
	0x0520:  9331 6178 92dc 2f66 2c30 0938 98a0 ca49  .1ax../f,0.8...I
	0x0530:  e980 0565 258e 5bb7 6388 279d 5ca2 70ed  ...e%.[.c.'.\.p.
	0x0540:  1069 e3e6 0cab b532 3544 447e b423 da50  .i.....25DD~.#.P
	0x0550:  3365 a5c3 4691 7071 93a9 f745 0784 28bb  3e..F.pq...E..(.
	0x0560:  6ac2 b694 0c44 cd05 3d33 f67e 4350 194c  j....D..=3.~CP.L
	0x0570:  813b c4d4 0b78 c82a 8175 018d e55a 0558  .;...x.*.u...Z.X
	0x0580:  b07d 6c4d bf16 8896 e285 fa3c 2bff fa73  .}lM.......<+..s
	0x0590:  9794 0d1f bef2 a2b2 65fc 091e 2ba2 4ff2  ........e...+.O.
	0x05a0:  f49d bca0 82f6 2186 f425 f224 8c90 cf74  ......!..%.$...t
	0x05b0:  32ac 93c5 3e94 9d00 e188 2fb8 7b37 001d  2...>...../.{7..
	0x05c0:  0020 4ff2 f49d bca0 82f6 2186 f425 f224  ..O.......!..%.$
	0x05d0:  8c90 cf74 32ac 93c5 3e94 9d00 e188 2fb8  ...t2...>...../.
	0x05e0:  7b37 0017 0041 0420 db65 26db 2417 69b1  {7...A...e&.$.i.
	0x05f0:  dc10 924e dd3b d54d 9b38 e1dc 21cb 3a32  ...N.;.M.8..!.:2
	0x0600:  9ab4 01cc 45ae d96f 3527 bbb8 9f5e e858  ....E..o5'...^.X
	0x0610:  ad5e a887 5412 bea2 b70c 6b7b 03c5 e1df  .^..T.....k{....
	0x0620:  b294 87d1 bf2b 1700 2b00 0504 0304 0303  .....+..+.......
	0x0630:  000d 0014 0012 0403 0503 0603 0804 0805  ................
	0x0640:  0806 0401 0501 0601 001c 0002 4001 001b  ............@...
	0x0650:  0007 0600 0100 0200 03fe 0d01 1900 0001  ................
	0x0660:  0001 1b00 206a b770 129b a477 037c f1fa  .....j.p...w.|..
	0x0670:  2c8b e158 0979 4704 8dea 30eb 899a 9ac6  ,..X.yG...0.....
	0x0680:  6f31 ea45 7500 efb1 cbe9 0bd8 1212 8fa5  o1.Eu...........
	0x0690:  5b0f 8ad1 11a4 6340 110e 0226 bcfa 658f  [.....c@...&..e.
	0x06a0:  afc1 0cda f75c a2c0 24e2 a848 fcec 0539  .....\..$..H...9
	0x06b0:  d13a ad05 bded 0fe0 85fa bdfe d838 cee9  .:...........8..
	0x06c0:  ade0 6ccd 6c40 a811 411a 1922 a175 2818  ..l.l@..A..".u(.
	0x06d0:  31be 9b15 03d8 315d 7d66 f4a3 8f3d 1ff7  1.....1]}f...=..
	0x06e0:  0971 79b9 5831 03cc 10b3 b1b4 4a19 8b98  .qy.X1......J...
	0x06f0:  a42e 7f2b a3c7 1fc5 7be1 350b ea9a 78bd  ...+....{.5...x.
	0x0700:  75f1 5632 e101 7e50 689f 5847 f6a8 88a4  u.V2..~Ph.XG....
	0x0710:  b441 25c5 d4a4 640c 912c cf17 8e91 3dfd  .A%...d..,....=.
	0x0720:  ea85 cb30 8849 e907 1bf7 dd1f b359 8b1e  ...0.I.......Y..
	0x0730:  1d2e 9772 2e97 4637 2c50 1bcf cf34 92a5  ...r..F7,P...4..
	0x0740:  c9ce 8122 6392 a673 b1e7 a795 ed50 8b36  ..."c..s.....P.6
	0x0750:  5bc8 cf1a 496c 6bcd 469c a292 7a48 1bf0  [...Ilk.F...zH..
	0x0760:  b84b 9d47 41d3 c93f cc5e a7db f116 a109  .K.GA..?.^......
	0x0770:  f0b7 9c7a b21c                           ...z..
12:28:37.680237 IP 192.168.8.100.7778 > 192.168.8.100.59748: Flags [.], ack 1859, win 83, options [nop,nop,TS val 3480375658 ecr 2472420727], length 0
	0x0000:  4500 0034 410c 4000 4006 679f c0a8 0864  E..4A.@.@.g....d
	0x0010:  c0a8 0864 1e62 e964 b688 83d4 9b06 01ea  ...d.b.d........
	0x0020:  8010 0053 923f 0000 0101 080a cf72 516a  ...S.?.......rQj
	0x0030:  935e 2577                                .^%w
```

which looks like probing the server with TLS 1.2/1.3 `ClientHello`...

**Comment by grgrzybek** [comment]
This ClientHello is _not_ related to HSTS (`network.stricttransportsecurity.preloadlist`)

**Comment by grgrzybek** [comment]
https://support.mozilla.org/en-US/kb/https-upgrades doesn't help much...

**Comment by grgrzybek** [comment]
`dom.security.https_first` doesn't help

**Comment by grgrzybek** [comment]
While Chrome doesn't send extra `ClientHello`, it sends _two_ additional SYN/SYN+ACK/ACK on two ports (below: 55786 and 55796):
```
13:50:34.665150 IP 192.168.8.100.55786 > 192.168.8.100.7778: Flags [S], seq 3785747916, win 65495, options [mss 65495,sackOK,TS val 1316893278 ecr 0,nop,wscale 10], length 0
	0x0000:  4500 003c 43cc 4000 4006 64d7 c0a8 0864  E..<C.@.@.d....d
	0x0010:  c0a8 0864 d9ea 1e62 e1a5 edcc 0000 0000  ...d...b........
	0x0020:  a002 ffd7 9247 0000 0204 ffd7 0402 080a  .....G..........
	0x0030:  4e7e 325e 0000 0000 0103 030a            N~2^........
13:50:34.665165 IP 192.168.8.100.7778 > 192.168.8.100.55786: Flags [S.], seq 3647944111, ack 3785747917, win 65483, options [mss 65495,sackOK,TS val 324276707 ecr 1316893278,nop,wscale 10], length 0
	0x0000:  4500 003c 0000 4000 4006 a8a3 c0a8 0864  E..<..@.@......d
	0x0010:  c0a8 0864 1e62 d9ea d96f 35af e1a5 edcd  ...d.b...o5.....
	0x0020:  a012 ffcb 9247 0000 0204 ffd7 0402 080a  .....G..........
	0x0030:  1354 11e3 4e7e 325e 0103 030a            .T..N~2^....
13:50:34.665176 IP 192.168.8.100.55786 > 192.168.8.100.7778: Flags [.], ack 1, win 64, options [nop,nop,TS val 1316893278 ecr 324276707], length 0
	0x0000:  4500 0034 43cd 4000 4006 64de c0a8 0864  E..4C.@.@.d....d
	0x0010:  c0a8 0864 d9ea 1e62 e1a5 edcd d96f 35b0  ...d...b.....o5.
	0x0020:  8010 0040 923f 0000 0101 080a 4e7e 325e  ...@.?......N~2^
	0x0030:  1354 11e3                                .T..
13:50:34.665228 IP 192.168.8.100.55796 > 192.168.8.100.7778: Flags [S], seq 957199976, win 65495, options [mss 65495,sackOK,TS val 3794049041 ecr 0,nop,wscale 10], length 0
	0x0000:  4500 003c 6aac 4000 4006 3df7 c0a8 0864  E..<j.@.@.=....d
	0x0010:  c0a8 0864 d9f4 1e62 390d b668 0000 0000  ...d...b9..h....
	0x0020:  a002 ffd7 9247 0000 0204 ffd7 0402 080a  .....G..........
	0x0030:  e224 9811 0000 0000 0103 030a            .$..........
13:50:34.665236 IP 192.168.8.100.7778 > 192.168.8.100.55796: Flags [S.], seq 997674, ack 957199977, win 65483, options [mss 65495,sackOK,TS val 3916902020 ecr 3794049041,nop,wscale 10], length 0
	0x0000:  4500 003c 0000 4000 4006 a8a3 c0a8 0864  E..<..@.@......d
	0x0010:  c0a8 0864 1e62 d9f4 000f 392a 390d b669  ...d.b....9*9..i
	0x0020:  a012 ffcb 9247 0000 0204 ffd7 0402 080a  .....G..........
	0x0030:  e977 2e84 e224 9811 0103 030a            .w...$......
13:50:34.665243 IP 192.168.8.100.55796 > 192.168.8.100.7778: Flags [.], ack 1, win 64, options [nop,nop,TS val 3794049041 ecr 3916902020], length 0
	0x0000:  4500 0034 6aad 4000 4006 3dfe c0a8 0864  E..4j.@.@.=....d
	0x0010:  c0a8 0864 d9f4 1e62 390d b669 000f 392b  ...d...b9..i..9+
	0x0020:  8010 0040 923f 0000 0101 080a e224 9811  ...@.?.......$..
	0x0030:  e977 2e84                                .w..
```

**Comment by grgrzybek** [comment]
Starting firefox with:
```
MOZ_LOG=nsSocketTransport:5,nsHttp:5,nsHostResolver:5 MOZ_LOG_FILE=firefox.log firefox -P
```

showed me this:
```
[Child 192118: Main Thread]: D/nsHttp nsHttpHandler::NewProxiedChannel [proxyInfo=0]
[Child 192118: Main Thread]: V/nsHttp Creating HttpBaseChannel @7f2d7e0a6838
[Child 192118: Main Thread]: D/nsHttp Creating HttpChannelChild @7f2d7e0a6800
[Child 192118: Main Thread]: E/nsHttp HttpBaseChannel::Init [this=7f2d7e0a6838]
[Child 192118: Main Thread]: E/nsHttp host=everfree.forest port=7778
[Child 192118: Main Thread]: E/nsHttp uri=http://everfree.forest:7778/favicon.ico
[Child 192118: Main Thread]: V/nsHttp HttpBaseChannel::SetReferrerInfoInternal [this=7f2d7e0a6838 aClone(1) aCompute(1)]
[Child 192118: Main Thread]: D/nsHttp HttpChannelChild 7f2d7e0a6800 ClassOfService flags=288 inc=0
[Child 192118: Main Thread]: D/nsHttp HttpChannelChild::AsyncOpen [this=7f2d7e0a6800 uri=http://everfree.forest:7778/favicon.ico]
[Child 192118: Main Thread]: D/nsHttp 7f2d7e0a6800 called from script: resource:///modules/FaviconLoader.sys.mjs:224:20
[Child 192118: Main Thread]: D/nsHttp HttpChannelChild::SetRequestHeader [this=7f2d7e0a6800]
[Child 192118: Main Thread]: V/nsHttp HttpBaseChannel::SetRequestHeader [this=7f2d7e0a6838 header="Cookie" value="" merge=0]
[Child 192118: Main Thread]: D/nsHttp nsHttpHandler::NotifyObservers [this=7f2d614dbe00 chan=7f2d7e0a6878 event="http-on-opening-request"]
[Child 192118: Main Thread]: V/nsHttp HttpBaseChannel::EnsureRequestContextID this=7f2d7e0a6838 id=2ea4400000097
[Child 192118: Main Thread]: D/nsHttp HttpChannelChild::ContinueAsyncOpen this=7f2d7e0a6800 gid=17179869186 browser id=2
[Child 192118: Main Thread]: D/nsSocketTransport STS dispatch [7f2d6159b6d0]
[Child 192118: Socket Thread]: V/nsHttp HttpBackgroundChannelChild::Init [this=7f2d6159f780 httpChannel=7f2d7e0a6800 channelId=17179869186]
[Child 192118: Socket Thread]: V/nsHttp HttpBackgroundChannelChild::CreateBackgroundChannel [this=7f2d6159f780]
[Child 192118: Socket Thread]: D/nsHttp HttpChannelChild::OnBackgroundChildReady [this=7f2d7e0a6800, bgChild=7f2d6159f780]
[Child 192118: Socket Thread]: V/nsHttp HttpBackgroundChannelChild::ActorDestroy[this=7f2d6157b980 reason=1]
[Child 192118: Main Thread]: D/nsHttp HttpChannelChild::RecvRedirect1Begin [this=7f2d7e0a6800]
[Child 192118: Main Thread]: D/nsHttp HttpChannelChild::Redirect1Begin [this=7f2d7e0a6800]
[Child 192118: Main Thread]: D/nsHttp HttpChannelChild::SetupRedirect [this=7f2d7e0a6800]
[Child 192118: Main Thread]: D/nsHttp nsHttpHandler::NewProxiedChannel [proxyInfo=0]
[Child 192118: Main Thread]: V/nsHttp Creating HttpBaseChannel @7f2d7e0abc38
[Child 192118: Main Thread]: D/nsHttp Creating HttpChannelChild @7f2d7e0abc00
[Child 192118: Main Thread]: E/nsHttp HttpBaseChannel::Init [this=7f2d7e0abc38]
[Child 192118: Main Thread]: E/nsHttp host=everfree.forest port=7778
[Child 192118: Main Thread]: E/nsHttp uri=https://everfree.forest:7778/favicon.ico
```

which means Firefox is trying to fetch the `favicon.ico` both with http and https...

**Comment by grgrzybek** [comment]
I decided to keep `executor=single` as the default value, but to make this issue less annoying:
 - the documentation is improved, highlight that `single` should not be used in production
 - added `favicon.ico` handling to JVM Agent, so Firefox doesn't try to fetch the icon using https

**Comment by grgrzybek** [comment]
Even if Jolokia serves `favicon.ico` over http, Firefox tries https anyway and doesn't even try http.
This can be fixed with `security.mixed_content.upgrade_display_content` option.
It defaults to `true` and causes:
```
Mixed Content: Upgrading insecure display request ‘http://everfree.forest:7778/favicon.ico’ to use ‘https’ [favicon.ico](http://everfree.forest:7778/favicon.ico)
```
